Zeitstempel,E-Mail-Adresse,Job title,Company name,Job Location,Deadline,Job description,Duties and responsibilities,Appreciated qualification and experience,Additional info (optional),Contact person name,Contact person email,URL/Link to job posting,Picture for job posting (if available)
15.04.2024 17:19:17,1,Data Engineer (d/f/m),mobile.de,Berlin,,"Our team's mission is to facilitate seamless communication between potential car buyers and dealers and build tools for dealers to help them manage their leads effectively. Collaborating closely with other teams, we integrate written communication requests, phone leads, financing requests, and other such leads into a cohesive product for a unified user experience. We aim to collect the right information and data points from dealers, offering and guiding them to what suits their needs best.

We are an agile, cross-functional, and cross-platform team that continuously improves the user experience on mobile.de iOS, Android, and Web applications.","You design, implement, schedule, supervise, document and maintain ETL/ELT pipelines into our data lake and data warehouse while following software engineering best practices

You are involved in the creation and definition of reports and dashboards to create transparency into current business processes

You are part of a cross-functional product development following the data mesh philosophy

You collaborate with analysts, data engineers, data scientists and product managers across mobile.de and serve as a contact for questions regarding the data related aspects of your team’s products

The core of our relevant tech stack is SQL, Python, Airbyte, DBT, BigQuery/Redshift, Looker ","You have 4+ years hands-on experience using big data technologies

You have worked with cloud providers, such as Amazon Web Services or Google Cloud Platform

You are familiar with building data pipelines and commonly used data technologies like DBT, Airbyte, Airflow, Kafka, Apache Spark or BigQuery/Redshift

You have experience consuming source data from SQL and no-SQL databases (mysql, mongodb), Kafka, S3, Google Analytics, REST APIs

You have experience with custom business logic implemented in Python or Scala.

You have experience with BI tools like Looker/Looker Studio, Data Studio or Tableau, easyBI

Experience having worked in a data mesh environment a big plus

Experience in data engineering in a marketplace environment a big plus

Experience with JVM based and Javascript based technologies a plus

Based or entitled to work in the EU and willing to relocate to the Berlin metropolitan area","An attractive Base Salary.
Participation in our Short Term Incentive plan (annual bonus).
Employee Stock Purchase Program.
Work From Anywhere: Enjoy up to 20 days a year of working from anywhere! Maybe not from the moon - well why not! just make sure you have internet connection!
A 24/7 Employee Assistance Program for you and your family, because we care.",,,https://www.mobile.de/careers/jobs/cdd7be5648f210014c1bbed7c32e0000/,https://drive.google.com/open?id=1joEfAMVk5HDmIq-xOzCtyXxD409USQhL
15.04.2024 17:21:39,1,Senior Data Scientist C2B (d/f/m),mobile.de,Berlin,,"At mobile.de, we are seeking a Senior Data Scientist (d/f/m) for our C2B Team in Berlin. Our team's mission is to empower Private Sellers and our Dealers, providing them with the best tools and data-driven insights to reach the perfect match. We focus on bridging the gap between individual sellers and dealerships, ensuring a seamless and efficient sales process. In this dynamic environment, we maintain a collaborative approach, fostering a close-knit and supportive team atmosphere. Join us in our pursuit to revolutionise the way private sellers engage with the automotive marketplace.","As a Senior Data Scientist, you will help us refine and personalise our pricing models. This ensures our sellers get both accurate and competitive prices for their cars based on the market situation and our dealers get access to a wide range of quality vehicles at fair and transparent prices.

Translate customer insights / business problems into impactful experiments/ ML challenges

Build POCs and demonstrate their value to stakeholders

Implement complex solutions using readable, reusable code along with the right technology

Iterate on and improve our pricing algorithm to ensure it's both competitive and precise

Leverage data to better understand user behaviours and segment them accordingly

Work closely with the team to use these insights to create specific products or services

Proactively support the team in shaping the strategic approach to develop our products and businesses

Implement continuous improvements to ensure we stay ahead in the market","Relevant education on MSc or Ph.D. level (statistics, computer science, economics, or similar)

4+ years of experience in software development and data analysis using Python, R, SQL and/or NoSQL

Proven data science experience – preferably in marketplaces and tech industries

Strong background in Machine Learning and Cloud Platforms

Experience in cross-functional product development (e.g. Developers, UX, Product Managers)

Passion for Agile (Kanban/Scrum) software development, product discovery, and continuous deployment

Based or entitled to work in the EU","An attractive Base Salary.
Participation in our Short Term Incentive plan (annual bonus).
Employee Stock Purchase Program.
Work From Anywhere: Enjoy up to 20 days a year of working from anywhere! Maybe not from the moon - well why not! just make sure you have internet connection!
A 24/7 Employee Assistance Program for you and your family, because we care.",,,https://www.mobile.de/careers/jobs/ac5aa0c7ef5e10018f38e06dad440000/,https://drive.google.com/open?id=11dEC7EnDl7sFvXZ8ug-RRkvjyAJCM0We
15.04.2024 17:24:07,1,Senior Data Engineer – Communications (d/f/m),mobile.de,Berlin,,"For our team in Berlin we are looking for a Senior Data Engineer (d/f/m) for our Communications team.

Our mission is to enable our customers to do the mobility changes that they need (buying and selling of vehicles, including concerns on the way like financing and insuring a car) completely online, and to enable the more than 40.000 car dealers in Germany who are our partners to compete in this increasingly digitized market by providing them top-in-class tools and processes. This specific role is for the Communication team, responsible for the written communication in mobile.de.

This agile and cross-functional team is equipped with software developers, UX specialists, product owners, analysts and business developers so that it can holistically own and grow this business and develop a product that serves our users’ needs excellently. Reporting to the Team Lead of Software Engineering, the person has the technical skills to manage data engineering, has a business focus and loves to work with passionate and engaged people in one of the world’s leading automotive platforms. Are you this person?","Experience creating detailed technical documentation building data flows into and out of our data lake / data mesh infrastructures and suggest/promote how data can enable better products and grow our business
You design, implement, schedule and supervise ETL/ELT pipelines into our data lake and data warehouse while following software engineering best practices
You are involved in the creation and definition of reports and dashboards to create transparency into current business processes
You craft clean, accurate, integrated, automatically tested, well-documented, and efficient datasets with a high usability for analysts and our users
You collaborate with analysts, data engineers, data scientists and product managers across mobile.de and serve as a contact for questions regarding the datasets of your business unit and you feel responsible for data quality and tackle issues
Develop and maintain backend solutions for customer-facing and internal applications and contribute to the team’s work with clean, maintainable and testable code, participate and lead design and code reviews","You have a degree in data engineering, data science, (business) computer science or comparable working experience
You have 4+ years hands-on experience using big data technologies in cloud environments, such as Amazon Web Services or Google Cloud Platform
You are familiar with building data integration pipelines and commonly used data technologies like dbt, Airbyte, Airflow, Kafka, Spark or BigQuery
You have knowledge about supporting build and deploy technologies (e.g. Maven/Gradle, Docker)
You have experience with relational and object databases like MySQL, MongoDB and comfortable with data exploration using SQL; NoSQL databases
You have experience with BI tools like Looker, Data Studio or Tableau
You have experience with Java/Spring Boot-based backend technologies and have implemented and consumed RESTful (micro-)services","An attractive Base Salary.
Participation in our Short Term Incentive plan (annual bonus).
Employee Stock Purchase Program.
Work From Anywhere: Enjoy up to 20 days a year of working from anywhere! Maybe not from the moon - well why not! just make sure you have internet connection!
A 24/7 Employee Assistance Program for you and your family, because we care.",,,https://www.mobile.de/careers/jobs/ecb3f7f62809100192dcb5ac14020000/,https://drive.google.com/open?id=15mmBaDE3xrZL7OcCjSryPVrH2GQwtHA3
16.04.2024 08:58:35,2,Experienced Machine Learning Research Scientists (f/m/x),ZEISS,Jena,,The employees of Corporate Research & Technology work under the best possible conditions on innovative technologies and the latest application possibilities that benefit all ZEISS business areas - from the Semiconductor Division to Microscopy and Medical Technology. We are looking for you for our team in Jena.,"Want to drive the next generation of intelligent products?

We are seeking passionate and talented scientists who want to drive the development of next generation products and cutting-edge machine learning algorithms at ZEISS. Integrated in a fast growing team of scientists and research engineers, you will develop core algorithms that extract information from the diverse data sources present across our complete product portfolio and take project ideas from academic and idea stages to prototypes. We have just started to scrape the surface of what can be done with the data our products deliver. You will contribute to realizing the prospects of machine learning, modern computer vision and scene understanding technologies for our customers. You will also support technology adoption and integration into our flagship products. This comprises conceptualizing, initiating, prototyping as well as scaling and instrumenting methods and evaluating their performance. During your work you build an excellent network with us in both academia and industry that will help us to leverage the latest technology advancements to address tomorrow's challenges.","You have
_a university degree and proven expertise in state-of-the-art machine learning techniques like multi-modal deep learning, autoML, or reinforcement learning - a PhD would be a plus

_a deep understanding of statistics and machine learning as well as best practices in model development and deployment

_a strong programming background in Python or C++ and familiarity with software development best practices and toolkits such as TensorFlow or pytorch

_a very good overview of latest research and industry trends as well as the ability to understand customer needs and to solve real-world problems

_the vision and hands-on mindset to make your ideas come to life in ZEISS products",,Katharina Dandorfer,,https://zeissgroup.wd3.myworkdayjobs.com/de-DE/External/job/Jena/Experienced-Machine-Learning-Research-Scientists--f-m-x-_JR_1008583-2?source=ZEISS,
16.04.2024 09:00:27,2,System Developer Algorithms (Metrology Software) (f/m/x),ZEISS,"Jena, Oberkochen",,"Shape the digital future of ZEISS in the Global Algorithms & Software Semiconductor Mask Solutions team!

Your sophisticated algorithms evaluate enormous amounts of image data in a highly efficient manner. Only in this way we enable the performance of our complex photomask systems - the essential building block to manufacture defect-free microchips. ","Your Role

Our high-tech measurement systems for semiconductor lithography are characterized by extreme demands on measurement performance. This performance is essentially achieved by optical components at the highest level. Nevertheless, remaining manufacturing tolerances lead to almost insurmountable accuracy limits. Breaking through these limits using algorithms is your new challenge at ZEISS.



You will architect and implement highly accurate mathematical-optical models and their numerical solutions in expert teams. Your tasks will range from conceptual design to implementation and performance evaluation. Product maturity and value adding algorithms are your success. You continuously expand your network within the company and are in close contact with our research partners.



Your innovation-driven mindset allows you to keep an eye on the latest technical developments and publications. You and your colleagues thus create the conditions for excellence","Your Profile

_Excellent practical programming experience with: Scientific Python, and possibly C++, preferably also with parallel computing (CUDA, Cloud)

_Ideally proven SW architecture skills and FOSS contributions

_Intensive experience in implementing numerical simulation methods and optimization techniques for solving forward and inverse problems

_Very good knowledge of classical image processing and machine learning as well as good physical and methodological knowledge of geometric and physical optics

_A very successfully completed degree in physics, computer science, engineering, or applied mathematics

_Great passion to successfully solve complex and difficult problems independently and in a team ",,Kathrin Siegel,,https://zeissgroup.wd3.myworkdayjobs.com/de-DE/External/job/Jena/System-Developer-Algorithms--Metrology-Software----f-m-x-_JR_1028590?source=ZEISS,
16.04.2024 09:02:32,2,Knowledge Graph Engineer (f/m/x),ZEISS,München,,"Your Role

You will play a crucial role in shaping the future of Data & Analytics and actively contribute to the success of the digital transformation at ZEISS. Within the Enterprise Data Management Team of our rapidly growing Data & Analytics organisation, you will help our business units to design, build, and maintain knowledge-based systems, driven by the vision to enable everyone to effectively find, learn, share, & innovate throughout the enterprise. ","You will

_Integrate information into knowledge-graph based systems and engage in data & knowledge / ontology modelling, knowledge graph construction, and validation

_Develop and apply algorithms based on graph queries / analytics (e.g., SPARQL), graph reasoning (e.g., RDFS+, OWL), AI/ML (e.g., NLP, graph embeddings) to enable various analytics use cases leveraging knowledge graphs

_Work in a team with data scientists, data & software engineers & product owners to create scalable, reusable and performant data-oriented applications, incl. e.g., chatbots, recommender, search, and other knowledge-based systems

_Convey technically difficult concepts in a clear and understandable way, translate business needs to technical specifications, and provide guidance for knowledge graph & ontology development to other teams

_Evaluate the latest methods and technologies and support the design of our data & analytics platforms and governance infrastructures - Continuously improve quality and performance while owning applications from idea to operations","
Your profile

_An excellent university degree (MSc/PhD) in information technology, computer science, natural sciences, or similar training

_At least 3 years of working experience in data integration, building (semantic) knowledge graphs, querying (graph) data using standard query languages (SQL, SPARQL)

_Familiarity with machine actionable languages (e.g., RDF), linked data principles and standards, & OWL-based ontology modelling in commonly used tools

_Excellent programming skills in Python, including mastering the standard libraries for NLP, machine learning and data science; knowledge of at least one other programming language (e.g. Java, Javascript) is a plus

_Solid understanding of at least one of Graph Analytics, Machine Learning / Deep Learning, Natural Language Processing

_An independent (“can-do”), solution-oriented and team-oriented way of working, not afraid to take on responsibility

_Strong desire to learn & upskill at the intersection of data, science & industry

_Experience with the following is welcome and considered as a plus: Cloud technologies like Microsoft Azure (e.g., Synapse, Databricks, Azure DevOps) - CI/CD using e.g., git, docker - Agile software-development using Scrum / Kanban",,"Annett Burger, Markus Repp",,https://zeissgroup.wd3.myworkdayjobs.com/de-DE/External/job/Mnchen/Senior-Knowledge-Graph-Engineer--m-f-d-_JR_1020632?source=ZEISS,
17.04.2024 10:33:31,3,Senior Backend Developer (m/w/d) - Germany based,Kraken Technologies Germany ,"Berlin, DE / – Software Engineering /Full-Time /Hybrid",,"Kraken is the technology tentacle of the Octopus Energy Group.

All technology is written and maintained by a multi-discipline engineering team of around 500 people globally. Our engineers work in ‘super teams’ which are focused on key domains of our platform as well as other innovative products. This also includes server-side, client-side and mobile engineers working closely with UX experts, copywriters and designers.

Teams are empowered to choose a way of working that works for them, often opting for a Kanban-like approach. Notion and Asana are then used to specify and manage work; Github, CircleCI and Terraform Enterprise as part of an immutable-infrastructure, continuous delivery pipeline; and Datadog, Sentry and Cloudwatch to measure performance and monitor production.

Some of our coding conventions are open-source .
 Kraken is a great place to learn, work with talented engineers and have a lot of fun.","- We have lots of difficult design challenges to solve. The utilities market is complicated, outdated and process-heavy - there's an awful lot of domain modelling that we need to get right. Strong attention to detail is essential.

-We have challenging technical problems to solve; like processing tens of millions of meter readings a day. We need the right technology in place to handle this smoothly as well as feeding data into a machine learning pipeline that models and predicts consumption. Or thinking about how we adapt Kraken to improve other utilities like water and broadband.

-There's a great opportunity for disruption across the energy market. The big suppliers still dominate, but are not exactly popular. The energy landscape is changing as we move to more dis-aggregated forms of generation, with less predictability, more dynamism and smarter technology.

-You'll be working for a company that’s fighting climate change. Our generation arm is the largest investor in solar generation in the UK, and is funding wind and anaerobic digestion. As a supplier, we're helping people to use greener technology and renewable energy, all helping move the UK towards a lower carbon future.","-Good communication in English - other languages such as German, French, Italian or Spanish is a plus

-A general interest in technology and problem-solving; someone diligent and thoughtful. It would be helpful to have experience/expertise in the following (in rough priority order):

-Python: You should have solid knowledge and experience in Python development to create efficient and scalable backend solutions.

-Django (or equivalent web framework): You have worked with Django or an equivalent web framework to support and accelerate web application development.

-Domain modeling: You possess competence in domain modeling and implementing these models into effective backend structures to support complex business logic.

-HTTP and REST APIs, as well as GraphQL: You have in-depth understanding and hands-on experience in developing and implementing both REST and GraphQL APIs, ensuring efficient communication and flexibility between frontend and backend systems.

-Writing robust and fault-tolerant software: You can write robust and fault-tolerant software that runs smoothly and reliably even under adverse conditions.

-Celery and async processing: You have gained experience with Celery and asynchronous processing to efficiently handle tasks in the background and optimize backend performance.

-Postgres: You have knowledge and experience in working with Postgres to develop and manage database applications that meet scalability, performance, and data integrity requirements.","Our Benefits: (Headline)

-An internationally positioned team with flat hierarchies and open and transparent communication

-We rely on flexible working hours

-Green energy starts with each individual: That's why you get discounted conditions for our electricity or gas tariffs.

-Share options: You will have the opportunity to participate in the international success of Octopus Energy Group Ltd. through share options.

-Language connects: Take your English skills to the next level with Busuu, our corporate language training provider

-For more exercise: Lease your favourite bicycle from us at a low price

-For a healthy work-life balance: train with Wellpass in over 6000 sports and health facilities all over Germany

-Eating makes you happy: We'll give you a monthly allowance of 108,45€ for your daily lunch (easily via app).

-For a relaxed commute to work: We reimburse you for public transport costs

-One less thing to worry about: we'll cover some of your childcare costs

-Whether online or offline - team cohesion and joint events are part of our everyday working life

-A stylish working environment in our Berlin office close to Moritzplatz in Kreuzberg

-For a secure future: the opportunity to take out a company pension scheme through us


Above all, we’re looking for someone who thrives on providing alternative opinions, challenging those around them and being challenged. We would prefer someone who can work in our Berlin office, but will consider remote candidates within Germany. Curious? In the podcast, our tech team tells you more about the work and culture at Octopus Energy. Have a listen! Tech-Team Podcast (only in German though..)
(Please use ""Tech- Team Podcast"" as a hyperlink: https://open.spotify.com/episode/05Em3Jn62NVgMS7Vi6klE6?si=14936448b22f46d7&nd=1&dlsi=94ee01a0db2d4f7a)
",,,https://jobs.lever.co/octoenergy/289517b4-e860-4e25-b1f7-42c935e0ee54  ,https://drive.google.com/open?id=1x6voVm0eLQtHOhNprPFXfR3c3pNWTrDg
